{
  "schemaVersion": "usai-model-catalog/v1",
  "generatedBy": "test fixture — do not use in production",
  "gateway": {
    "host": "api.gsa.usai.gov",
    "baseUrl": "https://api.gsa.usai.gov/api/v1",
    "api": "openai-completions",
    "apiKeyEnv": "USAI_API_KEY"
  },
  "vendors": [
    { "key": "anthropic", "label": "Anthropic", "order": 1, "usaiBackend": "amazon-bedrock" },
    { "key": "openai", "label": "OpenAI", "order": 2, "usaiBackend": "azure" }
  ],
  "models": [
    {
      "id": "fake-model-alpha",
      "vendor": "anthropic",
      "name": "Fake Model Alpha",
      "contextWindow": 200000,
      "maxOutputTokens": 64000,
      "cost": {
        "input": 1,
        "output": 5,
        "cacheRead": 0.1,
        "cacheWrite": 1.25
      }
    },
    {
      "id": "fake-model-beta",
      "vendor": "openai",
      "name": "Fake Model Beta",
      "contextWindow": 400000,
      "maxOutputTokens": 128000,
      "cost": {
        "input": 1.75,
        "output": 14,
        "cacheRead": 0.125
      },
      "costAbove200kContext": {
        "input": 3.5,
        "output": 28,
        "cacheRead": 0.25
      }
    },
    {
      "id": "fake-model-gamma",
      "vendor": "anthropic",
      "name": "Fake Model Gamma",
      "contextWindow": 1000000,
      "maxOutputTokens": 128000
    },
    {
      "id": "fake-model-delta",
      "vendor": "openai",
      "name": "Fake Model Delta",
      "contextWindow": 128000,
      "maxOutputTokens": 4000,
      "cost": {
        "input": 0.0375,
        "output": 0.15
      }
    }
  ]
}
